{
  "schema_version": "2025-12",
  "version": "1.0.0",
  "project_name": "HyperCode",
  "last_updated": "2025-12-16T16:38:00Z",
  "updated_by": "ai_research_agent",
  "research_data": {
    "core_concept": {
      "title": "HyperCode: Programming Language for Neurodivergent Minds & Future Computing",
      "mission": "Build a language that thinks like neurodivergent brains, integrates universal AI, and powers quantum/molecular computing",
      "core_principles": [
        "Resurrect forgotten genius from Plankalkül, Brainfuck, Befunge",
        "Design for neurodivergent brains first (ADHD, autistic, dyslexic)",
        "Universal AI compatibility (GPT, Claude, Mistral, Ollama)",
        "Living, breathing digital research paper with auto-updates",
        "Open source, professional-grade DevOps from day one"
      ],
      "target_audience": [
        "Neurodivergent programmers",
        "AI systems and LLMs",
        "Quantum computing researchers",
        "Molecular computing pioneers",
        "Inclusive tech communities"
      ]
    },
    "historical_roots": {
      "plankalkul": {
        "creator": "Konrad Zuse",
        "year": "1942-1945",
        "era": "Pre-computer era, first documented programming language",
        "features": [
          "2D syntax (spatial logic)",
          "Arrays and records",
          "Subroutines and functions",
          "Floating-point arithmetic",
          "Hierarchical data structures"
        ],
        "significance": "Pioneering spatial and structural thinking in programming",
        "modern_implementations": [
          {
            "name": "Joachim Hohmann implementation",
            "year": 1975,
            "language": "Historic documentation"
          },
          {
            "name": "Free University of Berlin",
            "year": 2000,
            "language": "Java-based IDE"
          },
          {
            "name": "SNU_2D_ProgrammingTools_IDE",
            "url": "https://github.com/seanpm2001/SNU_2D_ProgrammingTools_IDE_Plankalk-u-l",
            "year": 2023,
            "language": "Modern toolkit"
          },
          {
            "name": "Hovestar/Plankalkul",
            "url": "https://github.com/Hovestar/Plankalkul",
            "language": "Educational implementation"
          },
          {
            "name": "alexpdp7/plankalkul",
            "url": "https://github.com/alexpdp7/plankalkul",
            "year": 2024,
            "language": "Rust calculator PWA"
          }
        ]
      },
      "brainfuck": {
        "creator": "Urban Müller",
        "year": 1993,
        "features": [
          "8 commands only",
          "Turing complete",
          "Minimalist syntax",
          "Memory tape model"
        ],
        "turing_complete": true,
        "significance": "Extreme minimalism, proves power of simplicity",
        "modern_uses": [
          "Esoteric programming challenges",
          "Life simulations (research)",
          "Theoretical computer science",
          "Code golf competitions"
        ]
      },
      "befunge": {
        "creator": "Chris Pressey",
        "year": 1993,
        "features": [
          "2D grid-based execution",
          "Instruction pointer moves in cardinal directions",
          "Self-modifying code",
          "Stack-based operations",
          "Spatial thinking"
        ],
        "paradigm": "2D esoteric language",
        "significance": "Spatial instruction flow mirrors neurodivergent spatial reasoning"
      }
    },
    "neurodivergent_features": {
      "design_principles": [
        "Spatial logic over linear text",
        "Minimal cognitive noise",
        "Visual-first syntax",
        "Pattern recognition rewards",
        "Immediate feedback loops",
        "Hyperfocus-friendly targets",
        "No arbitrary complexity"
      ],
      "adhd_optimizations": {
        "hyperfocus_targets": [
          "Short modules with clear outcomes",
          "Real-time execution feedback",
          "Gamified progress tracking",
          "Time-boxed challenges"
        ],
        "immediate_feedback": true,
        "features": [
          "REPL-driven development",
          "Live syntax highlighting",
          "Instant error messages with fixes",
          "Progress visualization"
        ]
      },
      "autism_optimizations": {
        "pattern_recognition": true,
        "literal_semantics": true,
        "features": [
          "Explicit over implicit behavior",
          "Predictable syntax patterns",
          "No magical type coercion",
          "Clear state transitions",
          "Structured data first"
        ]
      },
      "dyslexia_optimizations": {
        "visual_first": true,
        "minimal_text": true,
        "features": [
          "Symbols over words",
          "Color-coded syntax",
          "Spatial layout for meaning",
          "Large, readable fonts",
          "High contrast defaults"
        ]
      },
      "compatible_languages": [
        {
          "name": "Python",
          "reason": "Readable, intuitive, minimal noise",
          "neurodivergent_benefits": [
            "Low syntax noise",
            "Enforced indentation (visual structure)",
            "REPL-first learning",
            "Active ADHD/autism programmer community"
          ]
        },
        {
          "name": "Scratch/Blockly",
          "reason": "Visual drag-and-drop blocks",
          "neurodivergent_benefits": [
            "Zero text parsing",
            "Spatial block arrangement",
            "Immediate visual feedback",
            "Ideal for dyslexia"
          ]
        },
        {
          "name": "Ruby",
          "reason": "Natural language-like syntax",
          "neurodivergent_benefits": [
            "Reads like English",
            "Flexible, creative expression",
            "Hyperfocus-friendly"
          ]
        },
        {
          "name": "Sona",
          "reason": "Neurodivergent-first design",
          "neurodivergent_benefits": [
            "Cognitive keywords (think, remember, focus)",
            "AI-native REPL",
            "Modular agents",
            "Built for mental flow"
          ]
        }
      ]
    },
    "ai_compatibility": {
      "supported_models": [
        {
          "name": "GPT-4 / GPT-4o",
          "provider": "OpenAI",
          "integration_type": "API-first, prompt engineering optimized",
          "capabilities": [
            "Code generation",
            "Architecture design",
            "Research synthesis",
            "Real-time assistance"
          ]
        },
        {
          "name": "Claude 3.x series",
          "provider": "Anthropic",
          "integration_type": "Agentic workflows, reasoning",
          "capabilities": [
            "Complex problem decomposition",
            "Ethical guardrails",
            "Extended context",
            "Research paper writing"
          ]
        },
        {
          "name": "Mistral",
          "provider": "Mistral AI",
          "integration_type": "Open-source, local deployment",
          "capabilities": [
            "On-device compilation",
            "Privacy-first execution",
            "Low-latency feedback"
          ]
        },
        {
          "name": "Ollama",
          "provider": "Community-driven",
          "integration_type": "Local LLM orchestration",
          "capabilities": [
            "Custom model loading",
            "Offline execution",
            "Research agent loops"
          ]
        }
      ],
      "hybrid_integration_patterns": [
        "AI-as-compiler: LLM generates optimized code",
        "AI-as-debugger: LLM identifies and fixes errors in real-time",
        "AI-as-researcher: Background agents keep knowledge graph updated",
        "AI-as-teacher: Context-aware suggestions and learning paths",
        "Human-AI co-creation: Interactive refinement loops"
      ],
      "repl_first": true,
      "research_agents": [
        {
          "name": "Knowledge Graph Agent",
          "function": "Auto-updates research data daily, surfaces new developments"
        },
        {
          "name": "Conflict Resolution Agent",
          "function": "Handles multi-device sync conflicts with version-based logic"
        },
        {
          "name": "Schema Evolution Agent",
          "function": "Validates backward compatibility, suggests migrations"
        },
        {
          "name": "Code Quality Agent",
          "function": "Runs CI/CD checks, flags schema violations"
        }
      ]
    },
    "quantum_molecular": {
      "quantum_languages": [
        {
          "name": "Qiskit",
          "provider": "IBM",
          "paradigm": "Gate-based quantum circuits",
          "features": [
            "Python integration",
            "Quantum simulator",
            "Real hardware access via cloud",
            "Optimization transpiler"
          ]
        },
        {
          "name": "Q#",
          "provider": "Microsoft",
          "paradigm": "Integrated quantum-classical",
          "features": [
            "Type-safe quantum operations",
            "Azure Quantum cloud",
            "Resource estimator",
            "Debugging tools"
          ]
        },
        {
          "name": "Cirq",
          "provider": "Google",
          "paradigm": "NISQ (Noisy Intermediate-Scale Quantum)",
          "features": [
            "Flexible circuit design",
            "Variational algorithms",
            "Superconducting qubits native",
            "Jupyter integration"
          ]
        },
        {
          "name": "Guppy",
          "provider": "Quantinuum",
          "paradigm": "High-level quantum abstraction",
          "features": [
            "Pythonic syntax",
            "Error mitigation",
            "Next-generation quantum systems",
            "Resource management"
          ]
        },
        {
          "name": "QuTiP",